{
  "id": "dnd35.prestige.mystic_theurge",
  "name_es": "Teúrgo místico",
  "source_family": "core_srd",
  "levels": 10,
  "hit_die": "d4",
  "bab": "half",
  "good_saves": [
    "will"
  ],
  "requirements": {
    "skills": {
      "Knowledge (arcana)": 6,
      "Knowledge (religion)": 6
    },
    "spellcasting": [
      "cast_arcane_level>=2",
      "cast_divine_level>=2"
    ]
  },
  "progression": {
    "arcane_spellcasting_levels": [
      1,
      2,
      3,
      4,
      5,
      6,
      7,
      8,
      9,
      10
    ],
    "divine_spellcasting_levels": [
      1,
      2,
      3,
      4,
      5,
      6,
      7,
      8,
      9,
      10
    ]
  },
  "milestones": {},
  "notes": [
    "Every class level advances one existing arcane and one existing divine class.",
    "No other class features from those classes are gained."
  ],
  "source_url": "https://www.d20srd.org/srd/prestigeClasses/mysticTheurge.htm"
}
