{
  "id": "dnd35.prestige.cerebremancer",
  "name_es": "Cerebromante",
  "source_family": "psionic_srd",
  "levels": 10,
  "hit_die": "d4",
  "bab": "half",
  "good_saves": [
    "will"
  ],
  "requirements": {
    "skills": {
      "Knowledge (arcana)": 6,
      "Knowledge (psionics)": 6
    },
    "spellcasting": [
      "cast_arcane_level>=2"
    ],
    "psionics": [
      "manifest_power_level>=2"
    ]
  },
  "progression": {
    "arcane_spellcasting_levels": [
      1,
      2,
      3,
      4,
      5,
      6,
      7,
      8,
      9,
      10
    ],
    "manifesting_levels": [
      1,
      2,
      3,
      4,
      5,
      6,
      7,
      8,
      9,
      10
    ]
  },
  "milestones": {},
  "notes": [
    "Every level advances one eligible arcane class and one eligible manifesting class."
  ],
  "source_url": "https://www.d20srd.org/srd/psionic/prestigeClasses/cerebremancer.htm"
}
