{
  "id": "dnd35.prestige.dragon_disciple",
  "name_es": "Discípulo del dragón",
  "source_family": "core_srd",
  "levels": 10,
  "hit_die": "d12",
  "bab": "three_quarters",
  "good_saves": [
    "fortitude",
    "will"
  ],
  "requirements": {
    "race_exclusions": [
      "dragon",
      "half_dragon"
    ],
    "skills": {
      "Knowledge (arcana)": 8
    },
    "languages_all": [
      "Draconic"
    ],
    "spellcasting": [
      "spontaneous_arcane_casting"
    ],
    "special": [
      "choose_dragon_variety_compatible_with_alignment"
    ]
  },
  "progression": {
    "prior_spellcasting": [],
    "bonus_spells_by_level": {
      "1": 1,
      "2": 1,
      "3": 0,
      "4": 1,
      "5": 1,
      "6": 1,
      "7": 0,
      "8": 1,
      "9": 1,
      "10": 0
    },
    "bonus_spell_effect": "adds_one_spell_per_day_to_an_existing_spontaneous_arcane_class_without_advancing_caster_level_or_spells_known"
  },
  "milestones": {
    "1": [
      "natural_armor_+1"
    ],
    "2": [
      "strength_+2",
      "claws_and_bite"
    ],
    "3": [
      "breath_weapon_2d8_1_per_day"
    ],
    "4": [
      "strength_+2_additional",
      "natural_armor_+2_total"
    ],
    "5": [
      "blindsense_30_ft"
    ],
    "6": [
      "constitution_+2"
    ],
    "7": [
      "breath_weapon_4d8_1_per_day",
      "natural_armor_+3_total"
    ],
    "8": [
      "intelligence_+2"
    ],
    "9": [
      "wings"
    ],
    "10": [
      "breath_weapon_6d8_1_per_day",
      "blindsense_60_ft",
      "dragon_apotheosis",
      "charisma_+2"
    ]
  },
  "notes": [
    "Dragon variety fixes energy type, line/cone shape, and the energy immunity gained at apotheosis.",
    "The breath weapon remains once per day; its damage increases at class levels 3, 7, and 10.",
    "Bonus spells add daily slots only and do not advance caster level or spells known.",
    "Dragon Apotheosis applies the SRD half-dragon transformation details stated in the class feature."
  ],
  "source_url": "https://www.d20srd.org/srd/prestigeClasses/dragonDisciple.htm"
}
