{
  "id": "dnd35.prestige.war_mind",
  "name_es": "Mente de guerra",
  "source_family": "psionic_srd",
  "levels": 10,
  "hit_die": "d10",
  "bab": "full",
  "good_saves": [
    "fortitude",
    "reflex"
  ],
  "requirements": {
    "alignment": "nonchaotic",
    "bab_min": 3,
    "skills": {
      "Knowledge (history)": 2,
      "Knowledge (psionics)": 8
    },
    "psionics": [
      "power_point_reserve>=1"
    ],
    "special": [
      "instruction_by_another_war_mind"
    ]
  },
  "progression": {
    "own_manifesting": "wisdom_based_psychic_warrior_list_up_to_level_5",
    "power_points_by_class_table": true
  },
  "milestones": {
    "1": [
      "personal_superiority_+2"
    ],
    "2": [
      "defensive_posture_+2"
    ],
    "3": [
      "damage_reduction_1_per_dash"
    ],
    "5": [
      "sweeping_strike"
    ],
    "6": [
      "damage_reduction_2_per_dash"
    ],
    "7": [
      "personal_superiority_+4"
    ],
    "8": [
      "defensive_posture_+4"
    ],
    "9": [
      "damage_reduction_3_per_dash"
    ],
    "10": [
      "overwhelming_force_10d6_1_per_day"
    ]
  },
  "notes": [
    "This class has its own PP and powers-known progression.",
    "Sweeping Strike and Overwhelming Force must follow the detailed movement and use limits."
  ],
  "source_url": "https://www.d20srd.org/srd/psionic/prestigeClasses/warMind.htm"
}
